<?xml version="1.0" encoding="utf-8" ?>
<xs:schema xmlns:xs="http://www.w3.org/2001/XMLSchema">
    <xs:element name="tickets">
        <xs:complexType>
            <xs:sequence>
                <xs:element name="ticket" minOccurs="0" maxOccurs="unbounded">
                    <xs:complexType>
                        <xs:sequence>
                            <xs:element name="userid" type="xs:int" />
                            <xs:element name="ticketid" type="xs:int" />
                            <xs:element name="datetimeissued" type="xs:dateTime" />
                            <xs:element name="subject" type="xs:string" />
                            <xs:element name="status" type="xs:string" />
                            <xs:element name="messages">
                                <xs:complexType>
                                    <xs:sequence>
                                        <xs:element name="message" maxOccurs="unbounded">
                                            <xs:complexType>
                                                <xs:sequence>
                                                    <xs:element name="datetime" type="xs:dateTime" />
                                                    <xs:element name="content" type="xs:string" />
                                                    <xs:element name="senderId" type="xs:int" />
                                                </xs:sequence>
                                            </xs:complexType>
                                        </xs:element>
                                    </xs:sequence>
                                </xs:complexType>
                            </xs:element>
                        </xs:sequence>
                    </xs:complexType>
                </xs:element>
            </xs:sequence>
        </xs:complexType>
    </xs:element>
</xs:schema>